Subcatory;Item;Price;Discount
Accessories;Generic Stylish African Woman Shower Curtain Bathroom Curtain Decoration Specification:180-180cm Style:African girl;1302.0;-50.0
Accessories;UNIVERSAL Hequeen Cute Ladybird Creative Toothbrush Holder Strength Suction Cup Home Essential Kids Favorite!;274.0;-50.0
Accessories;Generic Pretty Cotton & Linen Tissue Box Cover Paper Towel Container Storage Case Decoration Style:Black and white triangle;242.0;-50.0
Accessories;Generic Wall-Mounted Liquid Soap Dispenser Pump Stainless Steel Plastic Shampoo Conditioner Holder Bathroom Shower Tool Specification:Single cylinder white;1333.0;-50.0
Accessories;Generic 6pcs Bathroom set;2946.0;null
Accessories;Generic Automatic Toothpaste Dispenser + Toothbrush Holder Set Family;998.0;-33.0
Accessories;UNIVERSAL Hequeen Cute Bathroom Toothbrush Holder With 3 Minute Timer Hourglass To Encourage Kids;451.0;-50.0
Accessories;Generic 1 Pcs Creative Simulation Rose Handmade Soap Gift Box Home Decoration Unique Gift Style:Blue Bear Square Box;3572.0;-50.0
Accessories;Generic New Bathroom Suction Cup Flat Mirror Window Glass Defog Wiper Squeegee Glass;329.0;-30.0
Accessories;Generic Tandem Type Linkable Hanging Storage Bag Home Bathroom Organizer For Toilet Articles Color:black;420.0;-50.0
Accessories;Generic Electric USB hot melt glue hook - White;580.0;-34.0
Accessories;Generic Lenuo For Huawei P10 PC Ultra-thin Impact Protection Case(Blue);799.0;-33.0
Accessories;Generic Leaf Style Magnetic Leather Case for Xiaomi Redmi 5 Plus, with Holder & Card Slots & Wallet & Photo Frame (Black);699.0;-36.0
Accessories;Generic For Huawei Y7 Prime 5.5" Inch Hard PC + Acrylic Luxury 3 In 1 Combo Anti-knock Armor Back Case Cover Shell 320789;1439.0;-27.0
Accessories;Generic For Galaxy S6 / G920 S Line Anti-slip Frosted TPU Protective Case(Red);399.0;-33.0
Accessories;Generic 0.33mm 9H 2.5D Tempered Glass Film for OnePlus 6;599.0;-33.0
Accessories;UNIVERSAL Hot Touch Stylus S Writing Pen For Samsung Galaxy Note 10.1 N8000;289.0;-60.0
Accessories;Generic Huawei Honor 8 0.26mm 9H Surface Hardness Explosion-proof Silk-screen Tempered Glass Full Screen Film (Black);690.0;-30.0
Accessories;Generic LCD Multimedia Projector Mini LED Projector Premium UC18 500: 1 School Home Cinema Indoor Office;4079.0;-30.0
Accessories;Generic Wired Gaming Headset Headphones With Microphone For Sony PS4 Play;770.0;-23.0
Accessories;Generic For Wiko Jerry Variegated Butterflies Pattern Transparent Soft TPU Protective Back Cover Case;399.0;-33.0
Accessories;Generic For Samsung Galaxy Note 8 Nostalgic Tape Style TPU+PC Protective Back Case(Green);599.0;-33.0
Accessories;Generic For Fitbit Alta Smart Watch Silicone Watchband, Length: About 23.8cm(Black);599.0;-33.0
Accessories;Generic GKK For Xiaomi Redmi 4X PC Three - Paragraph Shield 360 Degrees Full Coverage Protective Case Back Cover (Black + Red);599.0;-33.0
Accessories;Generic 0.26mm 9H 2.5D Tempered Glass Film for Sony Xperia XZ2 Premium;399.0;-33.0
Accessories;UNIVERSAL Samsung Galaxy S6 Edge+ Plus 0.3mm 9H 3D Curved Full Screen CoverTempered Glass Screen Protector (Color:Black);3699.0;-43.0
Accessories;Generic For IPhone 6 & 6s 360 Degree Shockproof Oil Spout Silicone Back Case + PC Cover Combination Protective Case(Rose Gold);599.0;-33.0
Accessories;Generic Back Cover + SIM Card Tray For Nokia Lumia 920(Black);1199.0;-33.0
Accessories;Generic For Samsung Galaxy A5 (2017) / A520 Butterflies Love Flowers Embossing Horizontal Flip Leather Case With Holder & Card Slots & Wallet & Lanyard(Grey);599.0;-33.0
Accessories;Generic ENKAY Hat-Prince For Google Letv Le Pro3 0.26mm 9H Hardness 2.5D Explosion-proof Non-full Screen Tempered Gl Screen Film;599.0;-33.0
Accessories;Generic Smart Ring Magic Ring Black Waterproof NFC Jewellry Wearable Devices Mobile Phones Finger Ring;418.0;-30.0
Accessories;Generic For HTC 10 Evo 0.3mm 9H Surface Hardness 2.5D Curved Silk-screen Full Screen Tempered Gl Screen Protector(White);499.0;-38.0
Accessories;Generic HUION 1060 PRO+ 10 X 6 Inch Big Active 2048 Levels 5080 LPI Resolution Graphic Drawing Tablet Board With Digital Pen;13099.0;-34.0
Accessories;Generic AC 100-240V 18W Universal Qualcomm Quick Charge 3.0 USB Port Wall Charger With Type C USB Cable Set, US Plug , For Samsung, Google, LG, Huawei, Nokia, Microsoft, Xiaomi, OnePlus(Black);1399.0;-33.0
Accessories;Generic For Xiaomi Redmi Note 4 0.26mm 9H Surface Hardness Explosion-proof Silk-screen Tempered Gl Screen Film;499.0;-38.0
Accessories;Generic New TECNO L8 Phone Case Artistic Soft TPU Back Cover Silicone Clear;459.0;-30.0
Accessories;Generic Magnetic Metal Frame Tempered Glass Phone Protective Back Case Cover for iPhone X 7 8 Plus Color:Black frame (transparent back cover) Models:iPhone7p/8p;618.0;-50.0
Accessories;Generic For IPhone 6 Plus & 6s Plus Electroplating Soft TPU Protective Cover Case (White);499.0;-38.0
Accessories;Generic For Samsung Galaxy A8 (2018) Pink Plum Blossom Pattern Oil Embossed Soft TPU Protective Back Case;499.0;-38.0
Accessories;Generic Profession Q50 OLED Display Children Kids Smart Wrist Watch GPS Tracker Watch -white;1987.0;-66.0
Accessories;Generic For Wiko U Feel Lite Tower Bicyle Pattern Transparent Soft TPU Protective Back Cover Case;399.0;-33.0
Accessories;Generic Bluetooth Earphone Polaroid Sunglasses 2 In 1 270 Degrees Rotation Binaural Stereo Outdoor UV Protection Sports Riding Glasses;1069.0;-30.0
Accessories;ENKAY ENKAY Hat-Prince Xiaomi Redmi 5A 0.2mm 9H Surface Hardness 3D Explosion-proof Full Screen Carbon Fiber Soft Edges Tempered Glass Screen Film (White);590.0;-34.0
Accessories;UNIVERSAL Genuine Leather Watch Band For Motorola Moto 360 Smart Watch+Tool;791.0;-60.0
Accessories;Generic GKK For Xiaomi Redmi 5A Three-paragraph 360 Degree Full Coverage PC Protective Case Back Cover (Black+Red);599.0;-33.0
Accessories;Generic Sports Blood Pressure/Oxygen Heart Rate Fitness Smart Watch Wrist Band BK;2754.0;-25.0
Accessories;Generic NILLKIN For Huawei P20 Lite Nature TPU Transparent Soft Protective Case Back Cover Case(Transparent);899.0;-36.0
Necklaces;Generic Gold plated snake chain necklace;300.0;null
Necklaces;Fashion Anime Attack On Titan Shingeki no Kyojin Metal Necklace Pendant Scouting Legion;438.0;null
Necklaces;Neworldline Women Bohemia The Stars Ladies Classic Fashion Sexy Beach Pendant Layers Of Necklace-Gold;500.0;null
Necklaces;Generic Silver Plated Snake Chain Necklace;300.0;null
Necklaces;Generic Hot Sale Skull Magician Flower Pendant Women’s Alloy Necklace Purple;288.0;-57.0
Necklaces;Generic Refined Jewellery Beautiful Shinningstar.ng Necklaces For Women Metal Circles Fashion Accessories Long Necklaces;1073.0;-30.0
Necklaces;Generic Refined Jewellery Beautiful Shinningstar.ng Necklaces For Women Peach Heart Peant Fashion Accessories;829.0;-30.0
Necklaces;Fashion High-end Fashion Jewelry In Europe And Top-selling Four-leaf Clover Crystal Zirco Necklace;287.0;-50.0
Necklaces;Fashion Europe And The United States Film And Television Ghosts And Wives Kind Of Murder Doll Head Necklace;328.0;-50.0
Necklaces;Generic 100% Food Grade Teething Teether Necklace Soft Beads For Chew Baby Toddler Nursing Jewelry Toy For Mom To Wear BPA Free;793.0;-50.0
Necklaces;Neworldline Funky Long Tassel Chain Bling Rhinestone Tribal Jewelry Necklace Earrings Set-Red;1000.0;null
Necklaces;Generic 925 Sterling Silver Fashion Unique Stone Pendant Crystal Rhinestone Necklace Chain Jewelry Accessory For Women Girls Gift;861.0;-50.0
Necklaces;Generic New Fashion Personality Jewelry Popular Beam Neck Element Tide Female Multi-layer Full Diamond Necklace Sweet Atmospheric Temperament Necklace;699.0;-25.0
Necklaces;Generic Refined Jewellery Beautiful Shinningstar.ng Necklaces For Women Wishing Bottle Peant Fashion Accessories;809.0;-30.0
Necklaces;Generic JURE Fashionable S925 Sterling Silver Pendant Rotatable Zirconia Sparkle Pendant Heart-shaped Necklace 18 Inch;1657.0;-50.0
Necklaces;Generic New Women Fashion Trend Handmade Jewelry Personality Wild Multi-color Natural Irregular Colored Translucent Turquoise Necklace;999.0;-25.0
Necklaces;Generic Lucky Elephant Shapes Pendant Chain Necklaces Elegant Jewelry For Lady Ornament;252.0;-30.0
Necklaces;Generic Women Crystal 3D Yarn Butterfly Chokers Invisible Necklace Accessories;269.0;-30.0
Necklaces;Fashion New Fashion Classic Game M9 Knife Csgo Claw Knife Alloy Necklace Men Jewelry Accessories;252.0;-50.0
Necklaces;Generic Fashion Unique Vintage Retro Metal Necklace Chain With Rhinestone Crystal Pendant Jewelry For Women Girls Gift Party;349.0;-50.0
Necklaces;Generic Creative Fashion Enamel Princess Dress Beads Pendant Jewelry DIY Accessories;244.0;-30.0
Necklaces;Generic New Women Accessories Religious Style Geometric Square Western Religion Statue Pendant Alloy Necklace;699.0;-25.0
Necklaces;Fashion Tanson Hot Sale Birthday Gift Necklace Dried Flower GlWish Bottle Pendant Necklace Lovely Cute Necklace Red;232.0;-50.0
Necklaces;Generic JURE S925 Solid Sterling Silver Chain Necklace The One Jewelry Zirconia 18 Inch;1540.0;-50.0
Necklaces;Generic Devil PU Leather Punk Lady Pendant Necklace Choker Jewelry Fashion Ornament Gift;273.0;-30.0
Necklaces;Generic Crystal Star Ball Glass Galaxy Pattern Pendant Beauty Necklace Jewelry Gifts;308.0;-30.0
Necklaces;Generic Bohemian Womens Rhinestone Geometric Type Gem Pendant Statement Necklace PK;403.0;-40.0
Necklaces;Generic Jewelry Necklace Football Stainless Steel Outdoor Ornament Fashion Trendy;303.0;-30.0
Necklaces;Generic Women Girl Fashion Unique 925 Sterling Silver Zircon Rhinestone Crystal Ceramic Heart Shape Ring Pendent Necklace Chain Jewelry For Party Wedding Gift;1081.0;-50.0
Necklaces;Fashion New Stylish Women's Girls' Glamorous Gold Plated Flower Opal Rhinestone Charm Pendant Chain Necklace NWA (Size: One Size);419.0;-50.0
Necklaces;Fashion Colorful Rainbow Flower Buttons Flag Crystal Pendant Necklace Glass Cabochon Chain Necklace;227.0;-50.0
Necklaces;Fashion Europe And America Jewelry Natural Stone Crystal Pendant Necklace Women Long Chain Necklaces Zircon Inlaid Sweater Chain Necklace;305.0;-50.0
Necklaces;Generic JURE Fashionable S925 Sterling Silver Pendant Rotatable Zirconia Sparkle Pendant Rose-shaped Necklace 18 Inch;1917.0;-50.0
Necklaces;Generic Pendant Necklace Chain Unisex 3 Colors Dumbbell Beauty Women Choker Men Gifts;298.0;-30.0
Necklaces;Generic Europe & America Trend Of Fashion Personality Exaggerated Diamond Double Snake Dance Leather Short Necklace;799.0;-25.0
Necklaces;Generic Pendant Necklace Necklace Fashion Alloy Gold Women Gifts Choker Chain Beauty;299.0;-30.0
Necklaces;Fashion Tanson Vintage Jewelry Crystal Chunky Choke Statement Pendant Chain Necklace Purple Purple;425.0;-50.0
Necklaces;Generic JURE Fashionable S925 Sterling Silver Pendant Rotatable Zirconia Sparkle Pendant Square Pendant Necklace18 Inch;1859.0;-50.0
Necklaces;Generic Romacci Shinning Hollow Pearl Owl Pendant Collar Chain Necklace Jewelry;390.0;-50.0
Dumbbells;Generic Black Vinyl Kettle Bell - 12KG;6500.0;null
Dumbbells;Generic I.5 Metres Weight Bar - 50 mm Diameter;4000.0;null
Dumbbells;Generic Black Vinyl Kettle Bell - 4KG;2500.0;null
Dumbbells;Fukang Spirulina Food Supplement. 500mg*100 tablets;3000.0;null
Dumbbells;Generic Dumbell bars;3400.0;-64.0
Dumbbells;Generic Dumbell bars;3400.0;-64.0
Dumbbells;Generic I.2 Metres Weight Bar - 50 mm Diameter;3500.0;null
Dumbbells;Generic VINYL SOFT DUMBBELL 1KG;1650.0;null
Dumbbells;Generic 30 kgs Dumbells Weights - 15Kgs Each Side;10500.0;null
Dumbbells;Generic I.8 Metres Weight Bar - 50 mm Diameter;5000.0;null
Dumbbells;JOEREX JD8315 - Barbell - 10KG - Chrome;6500.0;-35.0
Dumbbells;Generic Weight bar 1" X 47";4000.0;null
Dumbbells;JOEREX JD8315 - Barbell - 15KG - Chrome;8500.0;-15.0
Dumbbells;Generic Black Vinyl Kettle Bell - 8KG;4500.0;null
Dumbbells;Generic black vinyl kettle bell 2kg;1200.0;null
Dumbbells;Kansa 25kg pair fixed (Hexagon shaped) rubber dumbbells;28000.0;null
Dumbbells;Kansa Electroplating Dumbbell Set - 10+10kg - Silver;11999.0;null
Dumbbells;Kansa 30kg pair fixed (Hexagon shaped) rubber dumbbells;33000.0;null
Dumbbells;Sunsky Bioelectric Impedance BIA Skin Analyzer Skin Tester;1399.0;-33.0
Dumbbells;JXD JX-DS930 3-station Multi Gym - Black;155000.0;null
Dumbbells;Sunsky CK-101S Full Automatic Wrist Blood Pressure Monitor;2599.0;-33.0
Dumbbells;Generic 3 PCS NEOTEX HOT SHAPERS Abdomen Belt, Size: S;999.0;-33.0
Dumbbells;Sunsky BP3 Xiaomi BP3 iHealth Smart Blood Pressure Dock Portable Bluetooth 4.0 Blood Pressure Meter Monitor, Support iOS 7.0 and Above & Android 4.3 and Above(White);5499.0;-34.0
Dumbbells;Sunsky CK-W133 Full Automatic Wrist Cuff Blood Pressure Monitor;3399.0;-33.0
Dumbbells;Sunsky CooSpo H6 Bimodule Heartbeat Rate Chest Belt, Bluetooth and ANT+, Compatible with both Android and iOS System;4999.0;-33.0
Dumbbells;Generic 3 PCS NEOTEX HOT SHAPERS Abdomen Belt, Size: 5XL;1099.0;-35.0
Dumbbells;Generic Retractable Tape Measure Tailor Body Size Sewing Cloth Tapeline, Length: 1.5m (Random Color Delivery);399.0;-33.0
Dumbbells;Generic Magic Silm Bamboo Fiber Beauty Control Panties / Hot Genie Butt Lifter Shaper for Postpartum Women(Black);999.0;-33.0
Dumbbells;Generic 20kg dumbells-10kg on each side.;10000.0;-41.0
Dumbbells;Generic Back Health Support Band Correct Rectify Posture Beauty Belt / Underwear for Women, Size: M(Beige);1199.0;-33.0
Dumbbells;Generic 3 PCS NEOTEX HOT SHAPERS Abdomen Belt, Size: M;899.0;-36.0
Dumbbells;Generic 5 PCS Belly Slimming Wonder Patch;699.0;-36.0
Dumbbells;Generic 3 PCS NEOTEX HOT SHAPERS Abdomen Belt, Size: 6XL;1099.0;-35.0
Dumbbells;Sunsky RZ201 Monitor Fingertip Blood Oxygen Saturation Pulse Oximeter with LED Display, Display, CE & ROHS Certificates;2099.0;-34.0
Dumbbells;Generic 3 PCS NEOTEX HOT SHAPERS Abdomen Belt, Size: 4XL;1099.0;-35.0
Dumbbells;Sunsky Full Automatic Wrist Cuff Blood Pressure Monitor, 90 Set Memory;2099.0;-34.0
Dumbbells;Sunsky Multi-function Waterproof Wireless Heart Rate Monitor Watch;2299.0;-34.0
Dumbbells;Sunsky Fingertip Pulse Oximeter, Display Size: 30mm x 20mm(White);2399.0;-33.0
Dumbbells;Generic HP-Smart Muscle Trainer Fat Burning Massager Muscle Stimulator Abdominal Training Black;1310.0;-66.0
Dumbbells;Generic Elastic Sports Waist Support Wrap Back Brace Protector Slimming Belt Body Building Belt for Gymnastics(Black);1999.0;-33.0
Decorative Pillows;Generic Greeen fibre made throwpillow;450.0;null
Decorative Pillows;Generic OVER THE DOOR HANGER;550.0;-8.0
Decorative Pillows;Generic Flowery Fibre Made Throw Pillow-Multicolored;480.0;null
Decorative Pillows;Generic White & Gold Love Letters Printing Pillow Case - 45cm x 45cm;849.0;-29.0
Decorative Pillows;Generic Light Bulbs Pattern Fluorescent Self-adhesive Wall Stickers for Home Decoration, Size: 40cm x 30cm;999.0;-33.0
Decorative Pillows;Smart Bedding & Beyond Bed Pillow - Pink & Brown stripe;1295.0;-14.0
Decorative Pillows;Generic 3D Toy Story Removable Wall Art Stickers, Size: 59 x 58 x 0.3 cm;2399.0;-37.0
Decorative Pillows;Generic Emoji throw pillow;620.0;-2.0
Decorative Pillows;Generic Creative World Cup Football Team Throw Pillow Case (without Pillow Inner) Style:Russia Size:45*45cm polyester;479.0;-50.0
Decorative Pillows;Generic Decor Scandinavia Canvas Cotton Chevron Design Decorative Throw Pillow Cover 18 X 18 in. (Yellow);459.0;-50.0
Decorative Pillows;Generic Emoji throw pillows;630.0;null
Decorative Pillows;Generic Yellow Soft Linen Square Pillow Case Car Sofa Waist Throw Cushion Cover Home Decoration Style:S1368 Size:45*45cm;399.0;-50.0
Decorative Pillows;Generic Colorful Skull Series Pillow Car Cushions Pillowcase Household Bedding;1500.0;-40.0
Decorative Pillows;Generic 2014 New Arrival Christmas Snowman Custom Zippered Square Pillowcase 18x18 (one side) Cushion Cover Case Pillow18-874;405.0;-50.0
Decorative Pillows;Generic High Density Seat Cushion-Black;1350.0;null
Decorative Pillows;Generic Fashion 2018 World Cup Emblem Linen Decorative Pillow Case Soft Home Sofa Pillowcase Cover Style:C Size:45 * 45 polyester linen;382.0;-50.0
Decorative Pillows;Generic Decorative Throw Pillow - Assorted Designs & Color - 8 Pieces;4190.0;-25.0
Decorative Pillows;Generic Yellow Soft Linen Square Pillow Case Car Sofa Waist Throw Cushion Cover Home Decoration Style:S1367 Size:45*45cm;394.0;-50.0
Decorative Pillows;Generic Printed Pillow Cushion Cover Throw Pillow Case Home Decor (without Pillow Inner) Style:M Size:45*45 polyester;387.0;-50.0
Decorative Pillows;Generic cushion cover;650.0;-19.0
Decorative Pillows;Generic Nordic Style 3D Tree Pattern Printed Throw Pillow Case Linen Cotton Cushion Cover Creative Decoration For Sofa, Car, Office Covers;1200.0;null
Decorative Pillows;Generic 12 PCS 3D Hexagonal Mirror Wall Stickers Set, Size: 8*8cm(Silver);599.0;-33.0
Decorative Pillows;Generic Double Layer and Double Color Sequins Pattern Variable Back Cushion Pillow 40*40CM Color:white;657.0;-50.0
Decorative Pillows;Generic High Density Seat Cushion-Maroon;1350.0;null
Decorative Pillows;Generic Juanshi Set of 2 Piece 19` X 19` Decorative Throw Pillow Cover Cushion Case Color Deep Blue;719.0;-50.0
Decorative Pillows;Generic Decorative white and gold pillow covers;720.0;-40.0
Decorative Pillows;Generic Soft Comfortable Plush Pillow Case Home Sofa Pillowcase Car Office Back Cushion Covers Color:light Grey Size:45 * 45cm;692.0;-50.0
Decorative Pillows;Generic Juanshi Set of 2 Piece 19` X 19` Decorative Throw Pillow Cover Cushion Case Color Green;752.0;-50.0
Decorative Pillows;Generic Floor Pillow;2500.0;null
Decorative Pillows;Generic Decorative Throw Pillow Cover Canvas Cotton Chevron Design 18 X 18 In. (Aqua Blue);594.0;-50.0
Decorative Pillows;Generic Paris Eiffel Tower Furnishing Articles Model Photography Props Creative Household Gift, Size:5 x 2.1cm(Gold);299.0;-40.0
Decorative Pillows;Generic Christmas Pillow Sofa Waist Throw Cushion Cover Home Decor RD;444.0;-39.0
Decorative Pillows;Generic Simple Fashion Throw Pillow Cases Cafe Sofa Cushion Cover Home Decor;409.0;-40.0
Decorative Pillows;Generic Cute Elk Home Decoration Pillow Cases Car Cushion Covers;1500.0;-40.0
Decorative Pillows;Generic Printed Pillow Cushion Cover Throw Pillow Case Home Decor (without Pillow Inner) Style:I Size:45*45 Polyester;363.0;-50.0
Baby, Kids & Toys;PAMPERS Diapers, Pants ,Size 6, (16+ Kgs) Jumbo Pack (Count 48);899.0;-49.0
Baby, Kids & Toys;PAMPERS Diapers, Pants , Size 3, Jumbo Pack (Count 62);899.0;-49.0
Baby, Kids & Toys;PAMPERS Diapers, Baby Dry - Maxi Pack - Size 4 (Count 64);1485.0;null
Baby, Kids & Toys;PAMPERS Unisex Size 5, Junior Pack (Count 60);1485.0;null
Baby, Kids & Toys;Carter's Cotton Flannel Receiving Blankets(set of 4)- cool theme;850.0;-43.0
Baby, Kids & Toys;Kidful Baby Carrier, High Quality Adjustable Red Carrier, Suitable For Newborns, Infants, Toddlers.;1085.0;-55.0
Baby, Kids & Toys;PAMPERS Baby Dry Diapers (Unisex) Size 4 -Count 64;1490.0;-15.0
Baby, Kids & Toys;Kidful Baby Travel Bed Portable, High quality Mattress With Mosquito Net and Zipper - Pink;1200.0;-70.0
Baby, Kids & Toys;PAMPERS Pants Jumbo Pack - Size 5 - (12-18kg) - 52 Pieces;1450.0;-17.0
Baby, Kids & Toys;Cotton Flannel Receiving Blankets(set of 4)- Blue theme;850.0;null
Baby, Kids & Toys;Top 2 Reclining Infant car seat with base 0-7 years (Red);8500.0;-43.0
Baby, Kids & Toys;PAMPERS Unisex Size 5, Jumbo Pack (Count 60);1490.0;-15.0
Baby, Kids & Toys;Generic Doube Electric Breast Pump - White;4299.0;-46.0
Baby, Kids & Toys;Kidful Diaper Bag, Multi Pockets Waterproof Nappy Bag For Travel, Large Capacity and Stylish, brown;1150.0;-54.0
Baby, Kids & Toys;Generic Infant bouncer/rocker- Blue with white stars;5175.0;-35.0
Baby, Kids & Toys;Carter's Cotton Flannel Receiving Blankets(set of 4)- Green theme;850.0;-43.0
Baby, Kids & Toys;Cotton Flannel Receiving Blankets(set of 4)- pink theme;850.0;null
Baby, Kids & Toys;FOFOS LARGE - Size 4 (9-15kgs) - 8 Diapers (COUNT 64);1099.0;-55.0
Baby, Kids & Toys;Top 2 Reclining Infant car seat with base 0-7 years (Blue);7605.0;-49.0
Baby, Kids & Toys;Generic Two strap comfortable baby Carrier with extra padding- blue;720.0;-71.0
Baby, Kids & Toys;Kidful Baby WashCloths, Organic Cotton Soft & best for Newborn Sensitive Skin Baby Wipe, Set of 8 With BONUS Baby Socks;450.0;-44.0
Baby, Kids & Toys;Kidful Baby Travel Bed Portable, High quality Mattress With Mosquito Net and Zipper, Kidful Blue With Free Baby Socks;1250.0;-69.0
Baby, Kids & Toys;Carter's Cotton Flannel Receiving Blankets(set of 4)- cute theme;850.0;-43.0
Baby, Kids & Toys;Huggies Gold Junior (Size 5) 12 - 22Kgs, Count 38;1625.0;-4.0
Baby, Kids & Toys;Cotton Receiving Blankets(set of 4);855.0;-57.0
Baby, Kids & Toys;Generic Top 2 Infant Polka Dot Car Seat( 0- 7 years);7605.0;-49.0
Baby, Kids & Toys;PHOENIX Disposable Baby Diapers, Size 4 , Count 40;604.0;null
Baby, Kids & Toys;Bummies Premium Diapers - Medium : Size 3 (5-9 Kg) COUNT: 36PCS;752.0;-20.0
Baby, Kids & Toys;Cotton Flannel Receiving Blankets(set of 4)- pink;855.0;-57.0
Washers And Dryers;Bruhm BWM-TL100H Top Load Washing Machine - 10 Kg;27999.0;-32.0
Washers And Dryers;ARMCO ACD-011MT - Multipurpose Clothes Dryer - Pink;4995.0;-38.0
Washers And Dryers;Samsung WA75H4000HA: Top Load Active Dual Wash , 7.5KG, 700RPM - Silver;36999.0;-18.0
Washers And Dryers;RAMTONS RW/115 -Twin Tub 8Kg Washer - White;21490.0;null
Washers And Dryers;RAMTONS RW/114-Super Jumbo 12Kg/14 Gross Twin Tub Washer-White & Grey;27995.0;null
Washers And Dryers;RAMTONS RW/146- 8KG Washer + 6Kg Dryer- Silver;73995.0;null
Washers And Dryers;Von Hotpoint HPTT10 - Twin Tub Washing Machine - 10Kg - White;21995.0;null
Washers And Dryers;RAMTONS RW/116 - Twin Tub 10 Kg Washer- White;22595.0;null
Washers And Dryers;ARMCO AWM-TT550P - 5 KG - Twin Tub - Pump - Magic Filter - Air Dry Function - White;10995.0;-31.0
Washers And Dryers;RAMTONS RW/125 - Twin Tub Washer - Air Dry - 6Kg - White;17500.0;-6.0
Washers And Dryers;Generic Portable Lightweight Multi-purpose Round Collapsible Wash Basin Fruit Bowl Color:Medium Rose Red;1636.0;-57.0
Washers And Dryers;Generic Smart Frog W-GYQ01 Portable Electric Hang Dryer - EU Plug - White;3200.0;-36.0
Washers And Dryers;Von Hotpoint HPTT7 - Twin Tub Washing Machine - 7 Kg - White;17995.0;null
Washers And Dryers;RAMTONS RW/145-Front Load Fully Automatic 6Kg Washer 1200 RPM- Silver;35000.0;-12.0
Washers And Dryers;Generic Portable Lightweight Multi-purpose Round Collapsible Wash Basin Fruit Bowl Color:Medium Green;1818.0;-57.0
Washers And Dryers;Generic Portable Lightweight Multi-purpose Round Collapsible Wash Basin Fruit Bowl Color:Large Blue;1408.0;-57.0
Washers And Dryers;RAMTONS RW/129 - Top Load Semi Auto Washer Only - 6Kg - White;10999.0;-15.0
Washers And Dryers;Generic Generic Waterproof Shower Curtain With Tree Design;1082.0;-57.0
Washers And Dryers;RAMTONS RW/140-Magic Cube 16Kg Top Load Washer- White;49190.0;-20.0
Washers And Dryers;Generic Portable Lightweight Multi-purpose Round Collapsible Wash Basin Fruit Bowl Color:Small Green;706.0;-55.0
Washers And Dryers;UNIVERSAL Waterproof Washing Machine Zippered Top Dust Cover Protection Top /Front Cover Pink Flower;501.0;-61.0
Washers And Dryers;Geepas GSWM6427 Washing Machine- 22KG White;12999.0;-48.0
Washers And Dryers;Generic Portable Rectangle Soap Box With Drain Layer & Lid Stylish Soap Dish For Travel School Color:Pink;265.0;-54.0
Washers And Dryers;Generic Generic Xrow - 800A Portable Mini Dehumidifier Air Dryer Household-WHITE;22000.0;null
Washers And Dryers;ARMCO ACD-011MT - Multipurpose Clothes Dryer - Blue;7995.0;null
Washers And Dryers;UNIVERSAL 3M Washing Machine Dishwasher Drain Hose Extension Pipe W/ Bracket Kit;2590.0;-61.0
Washers And Dryers;Louis will TDS Digital Water Quality Tester Purity Meter Test Filter Pen 0-9999 PPM;1989.0;-20.0
Washers And Dryers;CANDY CW/101- Candy 8KG GV148D3S/1-80 FL Washing Machine- Silver;51990.0;-26.0
Washers And Dryers;Generic Portable Rectangle Soap Box With Drain Layer & Lid Stylish Soap Dish For Travel School Color:blue;264.0;-54.0
Washers And Dryers;Generic Portable Lightweight Multi-purpose Round Collapsible Wash Basin Fruit Bowl Color:Small Rose Red;712.0;-55.0
Washers And Dryers;CANDY CW/102- Candy 9KG GV159TWC3S/3-80 FL Washing Machine- Silver;55990.0;-25.0
Washers And Dryers;Generic Smart Frog KW-GYQ01 Hanging Clothes Dryer with Shoe Drying Tube - EU Plug - White;3600.0;-36.0
Washers And Dryers;Louis will (US PULG)(2017 NEW) Portable Folding Electric Air Drying Clothes Dryer , Timer Clothing Heater Clothes Hanger Sterilization Ultra Light 3.5LB - Blue;7412.0;-14.0
Washers And Dryers;Generic Portable Lightweight Multi-purpose Round Collapsible Wash Basin Fruit Bowl Color:Large Green;1513.0;-57.0
Washers And Dryers;RAMTONS RW/136 - 12Kg Magic Cube Top Load Washing Machine- Silver;43490.0;null
Washers And Dryers;UNIVERSAL Dryer Idler Pulley Roller Wheel For Whirlpool,Sears,AP3094197,PS334244,279640 MH;350.0;-59.0
Washers And Dryers;RAMTONS RW/128 - Front Load Washer with Dryer - White;69295.0;null
Washers And Dryers;RAMTONS RW/144-Front Load Fully Automatic 7Kg Washer 1400 RPM- Silver;45000.0;-15.0
Washers And Dryers;UNIVERSAL Waterproof Washing Machine Zippered Top Dust Cover Protection Top /Front Cover Red Flower;565.0;-59.0
Brakes;Generic 720*540 Effective Pixel PAL 50HZ / NTSC 60HZ CMOS II Universal Waterproof Car Rear View Backup Camera Aluminum Alloy Cover, DC 12V, Wire Length: 4m;2099.0;-34.0
Brakes;Generic 4.3 inch Security TFT Monitor for Car Rearview Parking Video Systems;3899.0;-34.0
Brakes;Generic 720*540 Effective Pixel PAL 50HZ / NTSC 60HZ CMOS II Waterproof Car Rear View Backup Camera With 4 LED Lamps for 2012-2014 Version Fox;1799.0;-33.0
Brakes;Generic JX-9488 720*540 Effective Pixel PAL 50HZ / NTSC 60HZ CMOS II Universal Waterproof Car Rear View Backup Camera With 2W 80LM 5000K White Light 4LED Lamp, DC 12V, Wire Length: 4m;3699.0;-34.0
