Subcatory;Item;Price;Discount
Towers;HP Pro desk 290 G1 Desktop- 7TH Gen - Intel Core i5 - 1TB HDD - 4GB RAM - OS Not Installed - Black;58000.0;-15.0
Towers;Louis will 2017 IPad/Pro 9.7/Air2/Air Keyboard Case Cover with Auto Sleep / Wake Comfortable Chocolate Keyboard for IPad Pro 9.7 and IPad Air 1/2;6319.0;-16.0
Towers;HP 290 G1 Core i5 Desktop 4GB RAM 1 TB HDD;59000.0;-16.0
Towers;HP EliteDesk 800 G1-Core i5 - 4GB RAM, 500GB HDD - 3.2GHz - Desktop CPU- Free DOS (No Monitor) - Black;41500.0;-31.0
Towers;HP HP ProDesk 400 G4 Microtower PC - 18.5" Monitor - Intel Core i7-7700 - 1TB HDD - 8GB RAM - Free DOS - Black;115000.0;-12.0
Towers;HP ELITEDESK 800 G1 TOWER CORE I5 - 4GB RAM-500 GB HDD-WIN7-TOWER DESKTOP ALONE;40100.0;-23.0
Towers;HP Z230 Tower Workstation – Intel Coe i7 - 1TB HDD – Windows 8.1 Pro – Black;94000.0;null
Towers;HP Z230 tower workstation;95000.0;null
Towers;HP 290 G1 Desktop - 18.5" - 7TH Gen - Intel Core i5 - 500GB HDD - 4GB RAM - OS Not Installed - Black;59999.0;null
Towers;HP ProDesk 400 Microtower PC - 18.5" Monitor - Intel Core i5 - 500GB HDD - 4GB RAM - Free DOS - Black;62950.0;-9.0
Towers;HP ProDesk 400 G4 Microtower PC - 18.5" Monitor - Intel Core i7-7700 - 500GB HDD - 4GB RAM - Free DOS - Black;89999.0;-1.0
Towers;HP Pro 290G1 Desktop - 18.5" - No OS not Installed - Intel Core i5 - 500GB HDD - 8GB RAM - Black;67500.0;null
Juice;Splash Pineapple Juice - 1 Litre;93.0;-50.0
Juice;Splash Tropical Punch - 1 Litre;93.0;-50.0
Juice;Splash Orange Juice - 1 Litre;93.0;-50.0
Juice;Splash Simply Hibi Juice - 1 Litre;93.0;-50.0
Juice;Savanah Cocopine Juice - 2 Litres;250.0;null
Juice;Savanah Mango Juice - 2 Litres;250.0;null
Juice;Savanah Pineapple Juice - 2 Litres;250.0;null
Juice;Savanah Orange Juice - 2 Litres;250.0;null
Juice;Savanah Punch Juice - 2 Litres;250.0;null
Juice;Aquamist Fruit Juice 900ML- Tropical - 12 Bottles;1106.0;-16.0
Juice;Aquamist Fruit Juice 900ML- Guava - 12 Bottles;1106.0;-16.0
Juice;Pick N' Peel Tropical Mix - 1 Litre;199.0;-10.0
Juice;Pick N' Peel Tropical Mix - 1 Litre X 12PCS;2250.0;-4.0
Juice;Pick N' Peel Mango - 1 Litre;199.0;-10.0
Juice;Marche Lime Cordial - 700ml;220.0;-27.0
Juice;Pick N' Peel Mango - 1 Litre X 12PCS;2250.0;-6.0
Juice;Ante Barley Pure Barley Juice from New Zealand 3 packs of 10 Sachets, Each Sachet contains 3g of Pure Organic Barley Grass Powder;3750.0;-50.0
Juice;Treetop Dilute To Taste Juice - Strawberry & Banana 1case of - 3L *4;2250.0;null
Juice;Treetop Ready To Drink Mango - ( 2L x 6 );1920.0;null
Juice;Treetop Dilute To Taste - Orange -1L;400.0;null
Juice;Treetop Dilute To Taste Juice - Orange 1 case of 4* 3L;2250.0;null
Juice;Treetop Dilute To Taste Juice - Tropical - 1 case of 4*3L;2250.0;null
For Women;Wish for Women - Eau de Parfum - 75 ml;8500.0;null
For Women;Sparkling White Diamonds for Women - Eau de Toilette, 100ml;4000.0;-47.0
For Women;CALVIN KLEIN Endless Euphoria For Women EDP - 125ml;6500.0;-26.0
For Women;GUCCI Flora Gorgeous Gardenia for Women - Eau de Toilette, 100ml;9999.0;-33.0
For Women;White Diamond Brilliant for Women - Eau de Toilette, 100 ml;4000.0;-50.0
For Women;ELIZABETH ARDEN Pretty For Women EDP-100ml;6000.0;-29.0
For Women;ELIZABETH ARDEN Blue Grass For Women EDP – 100ml;5000.0;-29.0
For Women;ELIZABETH ARDEN Arden Beauty by Elizabeth Arden for Women Eau de Parfum, 100ml;2699.0;-64.0
For Women;MARC JACOBS Daisy Eau So Fresh Kiss for Women - Eau de Toilette, 75ml;9000.0;-38.0
For Women;ROBERTO MILANO Jennifer For Women 70 ml - Eau de Parfum;2999.0;-63.0
For Women;CALVIN KLEIN Pure Gold Euphoria for Women - Eau de Parfum, 100ML;6500.0;-35.0
For Women;JENIFFER LOPEZ Still for Women - Eau de Parfum, 100ml;3649.0;-57.0
For Women;Luron Tweety For Women EDP - 50 ml;144.0;-35.0
For Women;GUESS Guess Girl by Guess for Women Eau de Toilette, 100ml;2700.0;-65.0
For Women;GUESS Marciano for Women - Eau de Parfum, 100ml;7000.0;null
For Women;CALVIN KLEIN CK Beauty By Calvin Klein For Women EDP;4200.0;-53.0
For Women;BRITNEY SPEARS Midnight Fantasy by Britney Spears for Women Eau de Parfum, 100ml;3199.0;-56.0
For Women;CALVIN KLEIN Downtown for Women - Eau de Parfum, 90ml;4500.0;-51.0
For Women;DAVIDOFF Cool Water Wave For Women EDT - 100 ml;7000.0;null
For Women;AZZARO Club Women for Women - EDT, 75ml;3999.0;-50.0
For Women;CALVIN KLEIN CK IN2U for HerFor Women Eau de Toilette - 100ml;3499.0;-54.0
For Women;BRITNEY SPEARS Fantasy Intimate Edition for Women - Eau de Parfum, 100ml;4999.0;-50.0
For Women;CALVIN KLEIN CK One Shock for Women - Eau de Toilette, 200ml;4900.0;-51.0
For Women;CALVIN KLEIN Euphoria Blossom for Women - EDT, 100ml;5499.0;-50.0
Screen Protectors;Generic ENKAY Hat-Prince for Blackberry Priv 0.26mm 9H Surface Hardness 2.5D Explosion-proof Tempered Glass Screen Film;1141.0;null
Screen Protectors;Generic 10 PCS Huawei Mate 9 Pro 0.26mm 9H Surface Hardness 2.5D Explosion-proof Tempered Glass Non-full Screen Film;1709.0;null
Screen Protectors;Generic Tempered Glass Protective Anti-scratch Steel Film for Huawei Mate 9 Pro CL;250.0;-49.0
Screen Protectors;Generic X509 (zero) Screen Protector-Clear;499.0;-50.0
Screen Protectors;Nillkin 0.2mm 2.5D Tempered Glass Film Set For Mate 9 H + Pro - Transparent;979.0;-30.0
Screen Protectors;Huawei Ascend Y625 – Tempered Glass Protector – Clear;579.0;-40.0
Screen Protectors;Generic Huawei Honor 8 0.26mm 9H Surface Hardness Explosion-proof Silk-screen Tempered Glass Full Screen Film (Black);690.0;-30.0
Screen Protectors;UNIVERSAL Samsung Galaxy S6 Edge+ Plus 0.3mm 9H 3D Curved Full Screen CoverTempered Glass Screen Protector (Color:Black);3699.0;-43.0
Screen Protectors;Generic ENKAY Hat-Prince For Google Letv Le Pro3 0.26mm 9H Hardness 2.5D Explosion-proof Non-full Screen Tempered Gl Screen Film;599.0;-33.0
Screen Protectors;Generic For HTC 10 Evo 0.3mm 9H Surface Hardness 2.5D Curved Silk-screen Full Screen Tempered Gl Screen Protector(White);499.0;-38.0
Screen Protectors;Generic For Xiaomi Redmi Note 4 0.26mm 9H Surface Hardness Explosion-proof Silk-screen Tempered Gl Screen Film;499.0;-38.0
Screen Protectors;ENKAY ENKAY Hat-Prince Xiaomi Redmi 5A 0.2mm 9H Surface Hardness 3D Explosion-proof Full Screen Carbon Fiber Soft Edges Tempered Glass Screen Film (White);590.0;-34.0
Screen Protectors;Generic ENKAY Hat-Prince For Samsung Galaxy S9+ 3D Full Screen PET HD Screen Protector Film(Black);599.0;-33.0
Screen Protectors;Generic Huawei P10 Plus 0.26mm 9H Surface Hardness Explosion-proof Non-full Screen Tempered Glass Screen Film;590.0;-34.0
Screen Protectors;Generic 0.26mm 9H+ Surface Hardness 2.5D Explosion-proof Tempered Gl Film For Samsung Galaxy Note 5 / N920;399.0;-33.0
Screen Protectors;Generic For Blackberry Priv 0.26mm 9H Surface Hardness 3D Curved Explosion-proof Colorized Silk-screen Tempered Gl Full Screen Film(Black);599.0;-33.0
Screen Protectors;Generic Huawei Mate 10 Pro 9H Surface Hardness 2.5D Curved Edge HD Explosion-proof Tempered Glass Screen Protector (Black);690.0;-30.0
Screen Protectors;Generic ENKAY Hat-Prince For Huawei P20 Lite 0.1mm TPU+TPE+PET Material 3D Full Screen Explosion-proof Soft Screen Protector Water Condensate Film;799.0;-33.0
Screen Protectors;Generic Xiaomi Redmi 5A 0.26mm 9H Surface Hardness 2.5D Curved Edge Tempered Glass Screen Protector;590.0;-34.0
Screen Protectors;Generic For Huawei Mate 8 0.26mm 9H+ Surface Hardness 2.5D Curved Explosion-proof Tempered Gl Film;399.0;-33.0
Screen Protectors;Generic 0.3mm 3D Curved Explosion-proof Colorized Tempered Gl Full Screen Film With Titanium Alloy Edge For IPhone 6 Plus & 6s Plus(Grey);699.0;-36.0
Screen Protectors;Generic LOPURS 0.2mm 9H Surface Hardness 3D Curved Surface Full Screen Cover Explosion-proof Tempered Gl Film For Galaxy S6 Edge(Gold);599.0;-33.0
Screen Protectors;Generic For IPhone X Rear Camera Lens Protector Tempered Glass Protective Film;490.0;-29.0
Screen Protectors;Generic ENKAY Hat-Prince For Huawei Mate 10 Pro 0.26mm 9H Hardness 2.5D Curved Explosion-proof Tempered Gl Film;599.0;-33.0
Screen Protectors;Generic For Motorola Moto G5 Plus 0.26mm 9H Surface Hardness Explosion-proof Non-full Screen Tempered Gl Screen Film;399.0;-33.0
Screen Protectors;Generic For BlackBerry Keyone 0.3mm 9H Surface Hardness 3D Explosion-proof Full Screen Tempered Gl Screen Protector(Black);799.0;-33.0
Screen Protectors;Generic For ZTE Nubia M2 Lite 0.3mm 9H Surface Hardness 2.5D Curved Silk-screen Full Screen Tempered Gl Screen Protector(Gold);499.0;-38.0
Screen Protectors;Generic HD Back + Front Screen Protector For IPhone 6 & 6S;299.0;-40.0
Screen Protectors;Generic For Sony Xperia XZ1 0.26mm 9H Surface Hardness 3D Full Screen Tempered Gl Screen Protector(Transparent);799.0;-33.0
Screen Protectors;Generic For Sony Xperia XZ Premium 0.33mm 9H Surface Hardness 3D Silk-screen Full Screen Tempered Glass Screen Protector(Black);790.0;-34.0
Screen Protectors;UNIVERSAL Samsung Galaxy S6 Edge+ Plus 0.3mm 9H 3D Curved Full Screen Cover Tempered Glass Screen Protector (Color:Black);3699.0;-36.0
Screen Protectors;Generic 2 PCS For Huawei Y5 / Y5C / Y541 0.26mm 9H Surface Hardness 2.5D Explosion-proof Tempered Gl Screen Film;499.0;-38.0
Screen Protectors;Generic 2 PCS Xiaomi Redmi Note 5A 0.26mm 9H Surface Hardness 2.5D Explosion-proof Non-full Screen Tempered Glass Screen Film;590.0;-34.0
Screen Protectors;Generic 2 PCS For Motorola Moto G5 Plus 0.26mm 9H Surface Hardness Explosion-proof Non-full Screen Tempered Gl Screen Film;499.0;-38.0
Screen Protectors;Generic LOPURS 0.26mm 9H+ Surface Hardness 2.5D Explosion-proof Tempered Glass Film For Samsung Galaxy J7 / J700;590.0;-34.0
Screen Protectors;Generic For Samsung Galaxy S7 Edge / G935 0.26mm 9H Surface Hardness Explosion-proof Colorized Electroplating Tempered Glass Full Screen Film(Blue);790.0;-34.0
Screen Protectors;Generic For LG V20 0.26mm 9H Surface Hardness 2.5D Explosion-proof Tempered Glass Non-full Screen Film;590.0;-34.0
Men's Grooming;Sunsky Voltage Universal Fit Water Proof Triple Rotary Double Ring Blade Shaving Head Electric Rechargeable Shaver For Men, US Plug;6799.0;-33.0
Men's Grooming;Philips PHILIPS S100 / 02 Electric Shaver Double Heads Washing -BLUE;3260.0;-23.0
Men's Grooming;Generic LANDWIND Neck Massage Pillow Back Massager Cushion with Deep Heat Shiatsu Kneading for Neck Shoulder Back Muscle Pain-GRAY;9700.0;-23.0
Men's Grooming;Sunsky 220V 3 In 1 Water Proof Rechargeable Vibrissa Eyebrows Trimmer Body Hair Denudinghine Set, EU Plug(Pink);3599.0;-33.0
Men's Grooming;Philips PHILIPS S530 / 12 Electric Shaver Double Heads Washing-BLUE;8870.0;-23.0
Men's Grooming;Sunsky 220V Double Ring Three Head Rotary Electric Rechargeable Shaver For Men(Black+Gold);2999.0;-33.0
Men's Grooming;Sunsky Voltage Universal Fit Water Proof Triple Rotary Double Ring Blade Shaving Head USB Rechargeable Shaver For Men;6799.0;-33.0
Men's Grooming;KEMEI Kemei KM - 1210 3 in 1 Electric Nose Beard Ear Hair Trimmer-SILVER;1420.0;-23.0
Men's Grooming;KEMEI Kemei KM - 1619 Double Blade Floating Reciprocating Waterproof Rechargeable Men Electric Shaver-SILVER;2070.0;-23.0
Men's Grooming;Sunsky Cell Phone Razor Mini Micro USB Portable Electric Trimmer Shaver for Android Phones(Blue);999.0;-33.0
Men's Grooming;Sunsky SPORTSMAN Multi-functional Electric Rechargeable Vibrissa Hair Trimmer Beard Shaver And Denudinghine Set, EU Plug(Silver 220V);4999.0;-33.0
Men's Grooming;Sunsky Set Of Washable Manual Razor With Stainless Steel-Made Double Layer Classic Blade And Rubber Handle(black+silver);499.0;-38.0
Men's Grooming;Sunsky 8pcs Washable Stainless Steel-Made Double Layer Classic Blade For Men Razor(black+blue);299.0;-40.0
Men's Grooming;KEMEI Kemei KM - 2801 Comfortable Rechargeable Triple Floating Heads Electric Razor Shaver Beard with Trimmer for Men-BLUE;1340.0;-23.0
Men's Grooming;Sunsky 4 PCS Face Care Barber Shaving Razor Blade Refills Replacement Kit for Man;1599.0;-33.0
Men's Grooming;KEMEI Kemei KM - 3004A Reciprocating Multifunction Men Electric Facial Nose Ear Neck Eyebrow Hair Trimmer-WHITE;1250.0;-23.0
Men's Grooming;Generic POVOS PS2208 Men Electric Foil Shaver Rechargeable Wet / Dry Washable Razor-BLUE;1530.0;-23.0
Men's Grooming;GENERAL Natural Women Under Eye Pads Patches Anti-Wrinkle Dark Circle Remove Eye Pad;1568.0;-25.0
Men's Grooming;Sunsky Cell Phone Razor Mini 8 Pin Portable Electric Trimmer Shaver for iPhone(White);999.0;-33.0
Men's Grooming;GENERAL 24K Gold Facial Care Mask Personal Use Anti-Aging Dark Circle Eye Masks;1259.0;-25.0
Men's Grooming;Sunsky Washable Stainless Steel-Made Triple Layer Manual Razor Without Blade For Men(Black);399.0;-33.0
Men's Grooming;Generic WL - 2705 Sonic Vibration Facial Cleansing Brush Body Skin Electric Waterproof Massager - Golden;1180.0;-27.0
Men's Grooming;Sunsky 220v Two Rotary Double Ring Blade Shaving Head Electric Rechargeable Shaver For Men With Built-in Plug(Black);1799.0;-33.0
Men's Grooming;Generic Rs926 Rechargeable Razor Triple Blade Heads Electric Shaver for Men-BLACK;1440.0;-23.0
Men's Grooming;Sunsky SPORTSMAN Four-in-one Rechargeable Ear Nose Trimmer Electric Shaver Beard Face Eyebrows Hair Trimmer For Men, US Plug(Black, 110V);2199.0;-33.0
Men's Grooming;Sunsky Xiaomi ZHIBAI Men Electric Razor IPX7 Waterproof Rechargeable Mini Body Shaving;4199.0;-33.0
Men's Grooming;Sunsky Washable Stainless Steel-Made Double Layer Manual Razor Without Blade For Men(Grey);299.0;-40.0
Men's Grooming;Sunsky Cell Phone Razor Mini 8 Pin Portable Electric Trimmer Shaver for iPhone(Green);999.0;-33.0
Men's Grooming;Sunsky Cell Phone Razor Mini Micro USB & USB Portable Electric Trimmer Shaver for Android Phones & Devices with USB Ports(Blue);999.0;-33.0
Men's Grooming;Generic SID SS226 Rechargeable Electric Dual Floating Blade Shaving Razor Face Care-BLACK;1390.0;-23.0
Men's Grooming;KEMEI Kemei KM - 363 3 in 1 Rechargeable Electric 4 Floating Blade Washable Shaving Razor Face Care-GOLDEN;2310.0;-23.0
Men's Grooming;Sunsky Cell Phone Razor Mini 8 Pin Portable Electric Trimmer Shaver for iPhone(Blue);999.0;-33.0
Men's Grooming;Sunsky 10 PCS Professional Hairdressing Tools Scraper Blade Eyebrow Trimmer Shaving Scratching Hair Feather Blade(Silver);399.0;-33.0
Men's Grooming;Sunsky Multifunctional Shaver, Facial and Body Grooming Tool for Men;599.0;-33.0
Men's Grooming;Sunsky Hair Tools Double-sided Knife Hair Comb Hair Bangs Trimmer Thinning Device Hair Clipper(Pink);299.0;-40.0
Men's Grooming;Generic FLYCO FS829 Rotatable Dual Head Electric Shaver Cordless Rechargeable Razor-BLACK;1420.0;-23.0
Men's Grooming;GENERAL AFY Anti-Dark Circle Wrinkle Anti Puffiness Gold Snail Repair Eye Cream 30g;1875.0;-25.0
Men's Grooming;Sunsky Cell Phone Razor Mini Micro USB Portable Electric Trimmer Shaver for Android Phones(Green);999.0;-33.0
Men's Grooming;KEMEI Kemei KM - 6557 Reciprocating Rechargeable Electric Shaver-BLACK;1050.0;-23.0
Men's Grooming;KEMEI Kemei KM - 6635 3 in 1 Rechargeable Nose Beard Ear Sideburns Hair Trimmer-BLACK;1060.0;-23.0
Furniture;Kokobuy Elasticity Couch Sectional Sofa Furniture Slipcover 1/2/3 Seater 12 Colors;12029.0;null
Furniture;Kokobuy Digital STC-1000 Multipurpose Temperature Controller Thermostat With Sensor;1659.0;-41.0
Furniture;Generic Alarm Clock/Calendar/Thermometer Display Date/Time/Temperature Timer Digital LCD;997.0;-30.0
Furniture;Generic Home-Non-Woven Fabric Shoe Rack Stand Shelf Dustproof Multilayer Shoes Cabinet*Pink;1980.0;-66.0
Furniture;Generic 5Pcs Easy Pregnancy Screen Midstream HCG Test Predictor Home Essential*;388.0;-30.0
Furniture;Generic JIAFA JF-lron 60W Handheld Electric Soldering Iron, AC 220V, EU Plug;699.0;-36.0
Furniture;Generic 20Pcs Red Blue Scotchlocks Snap On Connector Wire Splicer Terminal;310.0;-30.0
Furniture;Generic Generic Auto Repair Tools Combination Spanner Socket 46 Sets Metric Hand Tools Sleeve Drivesocket Arbors Wrench;3814.0;-30.0
Furniture;Generic 10pcs Solder Iron Tips Welding Cleaning Absorbability Home Sponge Cleaner Lot;262.0;-30.0
Furniture;Generic Windmill Glass Beads Feather Windchimes Wall Hanging Home Decoration Gift;543.0;-30.0
Furniture;Generic Diffuser Humidifier Gifts Deep Wood Grain Light Wood Grain Lights Airhumidifier Filter Therapyaromadiffuser Wood;1338.0;-30.0
Furniture;Generic Hole Drill Bit Woodworking Drill Portable Hrome Vanadium Steel 5pcs Grinding Machine;1366.0;-30.0
Furniture;Generic Sucker Hook Hook Lovely 2PCS Color Random Kids Decorative Ladybug Wall Hooks Wall Cartoon;453.0;-30.0
Furniture;Generic PH Meter TDS Tester Aquarium Fishing Pool & Beverage Hydroponic Water Monitor;1318.0;-30.0
Furniture;Generic Digital Multimeter LCD Clamp AC DC Voltage Current Volt Amp Ohm Tester Meter;946.0;-30.0
Furniture;Generic DC900 Air Pump Fishing Aerator Fresh Quiet Oxygenated For Fish Tank Aquarium;783.0;-30.0
Furniture;Generic 12 Inch Silicone Non-slip Food Bread Barbecue BBQ Clip Tongs Kitchen Tools(Black);799.0;-33.0
Furniture;Generic Ice Cream Scoop Stainless Steel Cafe Accessories Dessert Party Restaurants Home;531.0;-30.0
Furniture;Generic 5W 3.5mm Ultra-thin USB A4 Paper LED Copy Pad Dimmable Digital Board Copy Desk Art Drawing Tracing Stencil Table Board;3399.0;-33.0
Furniture;Supreme Fabric L-Shape 5 Seater + Ottoman (Beige );48500.0;null
Furniture;Generic Leshery 65L 60*35*30cm Foldable Storage Bag Clothes Blanket Closet Sweater Organizer Box Charcoal;1123.0;-57.0
Furniture;Generic 2 PCS Anti-mosquito Silicone Repellent Bracelet Buckle Wristband Bugs Away, Suitable For Children And Adults, Length:23cm, Random Color Delivery;299.0;-40.0
Furniture;Chairs R Us New Arrival ! Ergonomic High-back Office Chair with Mesh Back and Fabric Seat;12500.0;-19.0
Furniture;Supreme Leather 6 Seater 3-2-1 (Black & White);150000.0;null
Furniture;Generic 3pcs Professional Adjustable Handmade Wood Soap Mold Cutter Slicer Tools Set;3087.0;-30.0
Furniture;Generic Quality Laser Edge Straight Line Guide Leveler Vertical Measure Tool Device;597.0;-30.0
Furniture;Roman Coimbra Wood Low Board TV Cabinet Tv Stand;38500.0;-14.0
Furniture;Generic Shoe Rack Organizer Stand Shelf Practical Animal Pattern Three Four Layers DIY Living Room Storage Cabinet Holder Shoeboxes;1440.0;-30.0
Furniture;Generic Traceless Manual Operation Wall Nailing Machine Nail Impactor?Nailer Wall Punch Creative Household Supplies Color:black;1251.0;-50.0
Furniture;DolphinEmpireHomes Maria Media Console Black & White Modern TV Stand;6999.0;-46.0
Furniture;Generic Large Capacity Canvas Standing Storage Bag Simple Laundry Toy Organizer With Handle Color:stitching Circle;895.0;-50.0
Furniture;Generic Allen Wrench Functional Pliers Hard Black 6 Inch Car Repair;1126.0;-30.0
Furniture;Generic Flat Screwdriver Tool Rubber Anti-skid Handle Steel Repairing Maintenance Tool*Black & Yellow;432.0;-64.0
Furniture;UNIVERSAL Home Chic Adjustable Double Shoe Rack Holder DIY Simple Portable Storage Rack;614.0;-50.0
Shoes;Generic Refined Women's Shoes Sexy Black Sliver Silver High Heels Shoes Spring Autumn Women Pumps Fashion Luxury Rhinestone Wedding Party Shoes04-black;3175.0;-30.0
Shoes;Generic Refined Women's Shoes Superior Quality Summer Style Comfortable Bohemia Platform Wedges Sandals For Lady Shoes High Platform Open Toe Flip Flops-blue;3024.0;-30.0
Shoes;Generic Refined Women's Shoes 2017 Women Sandals Summer Shoes Woman Flip Flops Plus Size 35-41 Fashion Women Beach Ladies Shoes-khaki;2886.0;-30.0
Shoes;Generic Refined Women's Shoes 2017 Spring Autumn Women Pumps Sexy Grey Gold Silver High Heels Shoes Fashion Luxury Rhinestone Wedding Party Shoes 06-grey;3175.0;-30.0
Shoes;Generic Refined Women's Shoes Sexy Black Sliver Silver High Heels Shoes Spring Autumn Women Pumps Fashion Luxury Rhinestone Wedding Party Shoes-red;3175.0;-30.0
Shoes;Generic Grace Spring Autumn Men's Canvas Shoes Sports Casual Youth Platform Shoes-gray;5999.0;-30.0
Shoes;Generic Grace Hight Quality Men Mountaineering Shoes Comfortable Casual Shoes Men Fashion Breathable Flats For Men Trainers Zapatos Hombre - Yellow;5999.0;-30.0
Shoes;Generic Refined Women's Shoes Sexy Black Sliver Silver High Heels Shoes Spring Autumn Women Pumps Fashion Luxury Rhinestone Wedding Party Shoes 03-brown;3175.0;-30.0
Shoes;Generic Refined Women's Shoes Sexy Black Sliver Silver High Heels Shoes Spring Autumn Women Pumps Fashion Luxury Rhinestone Wedding Party Shoes-red;3175.0;-30.0
Shoes;Generic Grace Spring And Summer Fashionable Men's Shoes Lazy Striped Men's Canvas Shoes-black;5999.0;-30.0
Shoes;Generic Refined Women's Shoes Sexy Black Sliver Silver High Heels Shoes Spring Autumn Women Pumps Fashion Luxury Rhinestone Wedding Party Shoes03-green;3175.0;-30.0
Shoes;Generic Refined Women's PU Leather Shoes Casual Lace-Up Chunky Heels Platform Shoes;2583.0;null
Shoes;Generic Refined Women's Shoes 02 Women's Leather Med Heels New High Quality Shoes Classic Pink&pink Pumps Shoes For Office Ladies Shoes-black;3361.0;-30.0
Shoes;Generic Refined Women's Shoes Sexy Black Sliver Silver High Heels Shoes Spring Autumn Women Pumps Fashion Luxury Rhinestone Wedding Party Shoes04-black;3175.0;-30.0
Shoes;Generic Generic Refined Women's Shoes Sexy Black Sliver Silver High Heels Shoes Spring Autumn Women Pumps Fashion Luxury Rhinestone Wedding Party Shoes 03-brown;3175.0;-30.0
Shoes;Generic Refined Women's Shoes Sexy Black Sliver Silver High Heels Shoes Spring Autumn Women Pumps Fashion Luxury Rhinestone Wedding Party Shoes03-green;3175.0;-30.0
Shoes;Generic Refined Women's Shoes Sexy Black Sliver Silver High Heels Shoes Spring Autumn Women Pumps Fashion Luxury Rhinestone Wedding Party Shoes 03-brown;3175.0;-30.0
Shoes;Generic Refined Women's Shoes 2017 Spring Autumn Women Pumps Sexy Green Gold Silver High Heels Shoes Fashion Luxury Rhinestone Wedding Party Shoes 09-green;3175.0;-30.0
Shoes;Generic Grace Hight Quality Men Mountaineering Shoes Comfortable Casual Shoes Men Fashion Breathable Flats For Men Trainers Zapatos Hombre - Grey;5999.0;-30.0
Shoes;Generic Refined Women's Shoes 2017 Spring Autumn Women Pumps Sexy Green Gold Silver High Heels Shoes Fashion Luxury Rhinestone Wedding Party Shoes 05-red;3175.0;-30.0
Shoes;Generic Refined Women's Shoes 2017 Spring Autumn Women Pumps Sexy Black Gold Silver High Heels Shoes Fashion Luxury Rhinestone Wedding Party Shoes 06-black;3175.0;-30.0
Shoes;Generic Slippers Summer Slip-On Flat Peep-Toe Pattern Rubber Sole Solid Color Open Toe;1240.0;-30.0
Shoes;Generic Refined Women's Shoes 2017 Spring Autumn Women Pumps Sexy Grey Gold Silver High Heels Shoes Fashion Luxury Rhinestone Wedding Party Shoes 06-grey;3175.0;-30.0
Shoes;Generic Womens Ladies Breathable Roma Style Flat Hollow Out Shoes Sandals Hole Slippers;983.0;-30.0
Shoes;Generic Casual Men Sneakers Round Toe Mesh Spliced Hook And Loop Shoes-BLACK WHITE;2719.0;-23.0
Shoes;Generic Refined Women's PU Leather Shoes Casual Lace-Up Chunky Heels Platform Shoes;2583.0;null
Shoes;Generic Women Beauty Bohemian Retro Tassel Flat Sandals Flip Flop T Strap Shoes;1723.0;-30.0
Accessories;Generic Creative Double Layers Soap Box Bathroom Soap Dish Sucker Holder Container;1298.0;null
Accessories;Generic Lilac Plastic Bathroom Organizer - Firm Sunction Cup;850.0;null
Accessories;Generic Toothpaste Dispenser Hands Free Automatic Tube Toothpaste Squeezer And Toothbrush Holder,White;740.0;null
Accessories;Generic Digital Glass Bathroom Scale;1299.0;-32.0
Accessories;UNIVERSAL Hequeen 2017Ladies Women Fashion Newest Toothbrush Holder Bathroom Kitchen Family Toothbrush Suction Cups Holder Wall Stand Hook Cups Organizer;364.0;-50.0
Accessories;Generic First Aid Kit Medical Emergency Bag Lightweight 35pcs/Set Canvas Treatment Pack;526.0;-30.0
Accessories;Generic Toothpaste Dispenser Hands Free Automatic Tube Toothpaste Squeezer And Toothbrush Holder;740.0;null
Accessories;UNIVERSAL Hequeen Multifunctional Toothbrush Racket Holder Storage Box Bathroom Makeup Accessories Products Sets Suction Hooks Kitchen Holder;795.0;-50.0
Accessories;Generic Silicon Toothbrush & Toothpaste Holder Bathroom Razor Storage Rack Decoration Color:green Specification:21.3X14.7X4cm;521.0;-55.0
Accessories;Generic 4 Layers Shower Corner Pole Caddy Shelf Holder Bathroom Storage Rack Organizer;4500.0;-18.0
Accessories;UNIVERSAL Electronic Pocket Mini Digital Gold Jewellery Weighing Scale 0.01g To 100 Gram;734.0;-61.0
Accessories;Generic Soap Dishes, Stainless Steel Soap Holder Basket with Strong Suction Cup, Wall Mount Bathroom Accessories Style:Silver plating Size:9*13;688.0;-50.0
Accessories;UNIVERSAL Hequeen New Cute Funny Cartoon Yellow / Red / Blue / Green Ladybug Sucker Suction Toothbrush Holder Hook;263.0;-50.0
Accessories;UNIVERSAL Hequeen Cute Funny Cartoon Ladybug Toothbrush Sucker Suction Hook Tooth Brush Holder;205.0;-50.0
Accessories;UNIVERSAL Hequeen Stylish Fashion Hot Sale Cute Funny Cartoon Green/Blue/Coffee Birds Sucker Suction Toothbrush Holder Home Hook;385.0;-50.0
Accessories;Generic 7 piece Bathroom Set - Floral Orange;2070.0;null
Accessories;UNIVERSAL Rectangle PU Leather Tissue Box Paper Napkin Box Pumping Carton;1495.0;-50.0
Accessories;Generic Soap Dish Holder Double Layers;550.0;null
Accessories;Generic 6pcs Bathroom set;2946.0;null
Accessories;UNIVERSAL Hequeen Cute Cartoon Animal Toothbrush Holder Suction Cup Hooks Bathroom Set Accessories Brush Cup Storage Box Holder Wash Cloth Clip Holder Bath Room Storage Hand Towel Rack Minion Tool Eco-Friendly Household Items Rabbit Cows Pig Cat Frog;222.0;-50.0
Accessories;Generic Nail-free Bathroom Towel Rack Traceless Storage Shelf Bath Towel Hanger Tower Bar Decoration Color:Green Specification:42cm*10.5cm*7.5cm;838.0;-50.0
Accessories;UNIVERSAL Hequeen Multifunctional Toothbrush Racket Holder Storage Box Bathroom Makeup Accessories Products Sets Suction Hooks Kitchen Holder;795.0;-50.0
Accessories;UNIVERSAL Hequeen 2017Ladies Women Fashion Newest Toothbrush Holder Bathroom Kitchen Family Toothbrush Suction Cups Holder Wall Stand Hook Cups Organizer;364.0;-50.0
Accessories;Generic 6pcs Bathroom set;2946.0;null
